{
  "site_id": "demo-lot",
  "mqtt": {
    "host": "broker.local",
    "port": 1883,
    "username": "demo-lot-gate-a",
    "password": "",
    "keepalive_s": 30
  },
  "http": {
    "port": 8080
  },
  "spool": {
    "max_events": 50000
  },
  "preview_frame_stride": 15,
  "plate": {
    "mode": "full",
    "region": "cn",
    "roi": [
      [
        0.2,
        0.3
      ],
      [
        0.8,
        0.3
      ],
      [
        0.8,
        0.95
      ],
      [
        0.2,
        0.95
      ]
    ],
    "stage2": {
      "model_path": "/models/plate_rec_cn.rk3588.int8.rknn",
      "input_hw": [
        32,
        96
      ],
      "classes": [
        0
      ],
      "expand": 0.08,
      "max_per_track": 7,
      "color": "rgb",
      "scale": 0.0039215686,
      "backend": ""
    },
    "vote": {
      "window": 7,
      "min_agree": 3,
      "min_conf": 0.6,
      "flush_min_agree": 2
    },
    "dedup_s": 30,
    "snapshot_dir": "/data/edge-parking/snapshots",
    "snapshot_retention_days": 7,
    "snapshot_max_mb": 2048
  }
}
