{
  "site_id": "demo-lot",
  "mqtt": {
    "host": "r1124.local",
    "port": 1883,
    "username": "demo-lot-gate-a",
    "password": "",
    "keepalive_s": 30
  },
  "http": {
    "port": 8080
  },
  "spool": {
    "max_events": 50000
  },
  "preview_frame_stride": 15,
  "plate": {
    "mode": "detect_only",
    "region": "cn",
    "roi": [
      [
        0.2,
        0.3
      ],
      [
        0.8,
        0.3
      ],
      [
        0.8,
        0.95
      ],
      [
        0.2,
        0.95
      ]
    ],
    "crop_picker": {
      "max_picks": 3,
      "min_gap_s": 1.0,
      "min_score": 0.5,
      "improve": 0.02
    },
    "dedup_s": 30,
    "snapshot_dir": "/data/edge-parking/snapshots",
    "snapshot_retention_days": 7,
    "snapshot_max_mb": 2048
  }
}
