{
  "site_id": "demo-lot",
  "mqtt": {
    "host": "broker.local",
    "port": 1883,
    "username": "demo-lot-gate-a",
    "password": "",
    "keepalive_s": 30
  },
  "http": {
    "port": 8080
  },
  "spool": {
    "max_events": 50000
  },
  "target_fps": 1,
  "unknown_after_s": 10,
  "slot_coverage": {
    "occupied_ratio": 0.3,
    "free_ratio": 0.2,
    "hold_s": 3.0,
    "free_hold_s": 5.0,
    "classes": [
      2,
      5,
      7
    ]
  },
  "slots": {
    "cam-b1-01": [
      {
        "id": "B1-023",
        "polygon": [
          [
            0.1,
            0.55
          ],
          [
            0.22,
            0.55
          ],
          [
            0.25,
            0.8
          ],
          [
            0.08,
            0.8
          ]
        ]
      }
    ]
  }
}
